{
  "$schema": "http://json-schema.org/draft-07/schema#",
  "title": "Claude Workspace Configuration",
  "type": "object",
  "properties": {
    "project": {
      "type": "object",
      "properties": {
        "name": { "type": "string" }
      },
      "required": ["name"]
    },
    "preferences": {
      "type": "object",
      "properties": {
        "language": { "type": "string", "description": "User's preferred language (e.g., es, en, pt, fr, it, de)" },
        "defaultWorkflow": { "enum": ["quick", "standard", "complete"] },
        "autoCommit": { "type": "boolean" },
        "verboseOutput": { "type": "boolean" },
        "confirmDestructive": { "type": "boolean" }
      }
    },
    "sessions": {
      "type": "object",
      "properties": {
        "basePath": { "type": "string" },
        "autoArchiveAfterDays": { "type": "integer", "minimum": 1 },
        "maxActiveStories": { "type": "integer", "minimum": 1 },
        "maxActiveTasks": { "type": "integer", "minimum": 1 }
      }
    },
    "taskManager": {
      "type": "object",
      "properties": {
        "enabled": { "type": "boolean" },
        "provider": { "enum": ["clickup", "jira", "notion", "asana", "linear", "custom"] },
        "syncWithSession": { "type": "boolean" },
        "autoUpdateStatus": { "type": "boolean" },
        "config": {
          "type": "object",
          "properties": {
            "apiKey": { "type": "string" },
            "workspaceId": { "type": "string" },
            "defaultList": { "type": "string" },
            "useMcp": { "type": "boolean" },
            "mcpFallback": { "type": "boolean" }
          }
        }
      }
    },
    "worktrees": {
      "type": "object",
      "description": "Git worktree configuration for parallel feature development",
      "properties": {
        "enabled": { "type": "boolean", "description": "Show worktree question in session:start" },
        "basePath": { "type": "string", "description": "Base directory for worktrees (relative to repo parent). Default: sibling to repo" },
        "autoInstall": { "type": "boolean", "description": "Automatically run pnpm install in new worktrees" },
        "cleanupOnClose": { "type": "boolean", "description": "Ask to remove worktree on session:close" }
      }
    },
    "integrations": {
      "type": "object",
      "properties": {
        "github": {
          "type": "object",
          "description": "GitHub integration - detailed config in .claude/config/github.json",
          "properties": {
            "enabled": { "type": "boolean" }
          }
        }
      }
    }
  }
}
