{
  "$schema": "./workspace.schema.json",

  "project": {
    "name": "My Project"
  },

  "preferences": {
    "language": "es",
    "defaultWorkflow": "standard",
    "autoCommit": false,
    "verboseOutput": false,
    "confirmDestructive": true
  },

  "sessions": {
    "basePath": ".claude/sessions",
    "autoArchiveAfterDays": 30,
    "maxActiveStories": 3,
    "maxActiveTasks": 10
  },

  "taskManager": {
    "enabled": false,
    "provider": "clickup",
    "syncWithSession": true,
    "autoUpdateStatus": true,
    "config": {
      "apiKey": "${CLICKUP_API_KEY}",
      "workspaceId": "",
      "defaultList": "",
      "useMcp": true,
      "mcpFallback": true
    }
  },

  "worktrees": {
    "enabled": true,
    "basePath": "..",
    "autoInstall": true,
    "cleanupOnClose": true
  },

  "integrations": {
    "github": {
      "enabled": true
    }
  }
}
